{"$id":"provan.acceptance_attestation.v1","$schema":"https://json-schema.org/draft/2020-12/schema","additionalProperties":false,"properties":{"attestation_id":{"format":"uuid","type":"string"},"builder_provenance":{"minProperties":1,"type":"object"},"challenge_state":{"additionalProperties":false,"properties":{"pack":{"type":"null"},"requirement":{"type":"object"},"seed":{"type":"null"},"siblings":{"enum":["not_run"]},"state":{"enum":["not_run","not_required","unavailable"]}},"required":["requirement","state","pack","seed","siblings"],"type":"object"},"conditional_activation":{"items":{"additionalProperties":false,"properties":{"basis":{"minLength":1,"type":"string"},"criterion_ref":{"minLength":1,"type":"string"},"evidence_refs":{"items":{"minLength":1,"type":"string"},"type":"array"},"reason_code":{"minLength":1,"type":"string"},"state":{"enum":["active","inactive","unresolved"]}},"required":["criterion_ref","state","basis","evidence_refs","reason_code"],"type":"object"},"type":"array"},"context_provenance":{"minProperties":1,"type":"object"},"contract_ref":{"additionalProperties":false,"properties":{"id":{"minLength":1,"type":"string"},"sha256":{"pattern":"^sha256:[0-9a-f]{64}$","type":"string"}},"required":["id","sha256"],"type":"object"},"created_at":{"format":"date-time","type":"string"},"effective_status":{"enum":["active","expired"]},"evidence_refs":{"additionalProperties":false,"properties":{"imported":{"items":{"minLength":1,"type":"string"},"type":"array"},"missing":{"items":{"minLength":1,"type":"string"},"type":"array"},"model":{"items":{"minLength":1,"type":"string"},"type":"array"},"operator":{"items":{"minLength":1,"type":"string"},"type":"array"},"source":{"items":{"minLength":1,"type":"string"},"type":"array"}},"required":["source","imported","operator","model","missing"],"type":"object"},"expires_at":{"format":"date-time","type":["string","null"]},"freeze_ref":{"additionalProperties":false,"properties":{"id":{"minLength":1,"type":"string"},"sha256":{"pattern":"^sha256:[0-9a-f]{64}$","type":"string"}},"required":["id","sha256"],"type":"object"},"owner_placeholders":{"additionalProperties":false,"properties":{"accepted_risk":{"const":"not_decided"},"conditions":{"const":"not_decided"}},"required":["accepted_risk","conditions"],"type":"object"},"projection_refs":{"additionalProperties":false,"properties":{"client_safe":{"format":"uuid","type":"string"},"internal":{"format":"uuid","type":"string"}},"required":["internal","client_safe"],"type":"object"},"promotion_provenance":{"minProperties":1,"type":"object"},"protected_invariant_refs":{"items":{"additionalProperties":false,"properties":{"id":{"minLength":1,"type":"string"},"sha256":{"pattern":"^sha256:[0-9a-f]{64}$","type":"string"}},"required":["id","sha256"],"type":"object"},"type":"array"},"provenance":{"minProperties":3,"type":"object"},"recommendation":{"enum":["cleared","held","not_eligible"]},"reinspection_requirements":{"items":{"additionalProperties":false,"properties":{"id":{"minLength":1,"type":"string"},"sha256":{"pattern":"^sha256:[0-9a-f]{64}$","type":"string"}},"required":["id","sha256"],"type":"object"},"type":"array"},"schema_id":{"const":"provan.acceptance_attestation.v1"},"settlement_ref":{"additionalProperties":false,"properties":{"id":{"minLength":1,"type":"string"},"sha256":{"pattern":"^sha256:[0-9a-f]{64}$","type":"string"}},"required":["id","sha256"],"type":"object"},"subject":{"additionalProperties":false,"properties":{"candidate_digest":{"pattern":"^sha256:[0-9a-f]{64}$","type":"string"},"repository_identity":{"minLength":1,"type":"string"}},"required":["repository_identity","candidate_digest"],"type":"object"},"usage":{"additionalProperties":false,"properties":{"execution_calls":{"const":0},"model_calls":{"const":0}},"required":["model_calls","execution_calls"],"type":"object"},"verifier_state":{"additionalProperties":false,"properties":{"capability":{"enum":["unavailable","unqualified","qualified"]},"environment":{"enum":["unqualified","qualified","unavailable"]},"execution":{"enum":["not_run","executed"]},"work_order_refs":{"items":{"minLength":1,"type":"string"},"type":"array"}},"required":["capability","execution","environment","work_order_refs"],"type":"object"}},"required":["schema_id","attestation_id","subject","freeze_ref","contract_ref","builder_provenance","verifier_state","context_provenance","promotion_provenance","protected_invariant_refs","evidence_refs","settlement_ref","conditional_activation","challenge_state","recommendation","owner_placeholders","expires_at","effective_status","reinspection_requirements","usage","provenance","projection_refs","created_at"],"type":"object"}
