{"attestation_id":"17a0c88b-6ae5-4507-bf73-6402bd588b0d","builder_provenance":{"package_version":"0.4.0","policy_id":"community.acceptance.v1","policy_version":"1","schema_registry_digest":"sha256:4883f894956a1a6c20135138a529c416ebd10004eea8931808a830054ff43758"},"challenge_state":{"pack":null,"requirement":{"challenge_budget":{"class":"not_required","max_instances":0,"max_network_requests":0,"max_wall_seconds":0},"criteria_requiring_challenge":[],"prohibited_actions":["challenge_generation","challenge_execution","pack_creation","seed_creation","sibling_creation"]},"seed":null,"siblings":"not_run","state":"not_run"},"conditional_activation":[],"context_provenance":{"brief_ref":{"id":"ad373fa0-cdfb-4782-90a0-e180699a6d1d","sha256":"sha256:a6b1f3618d0c9bc38047fdc73513a18b55fbf36338dfa635f58aebdb8401b419"}},"contract_ref":{"id":"9df9812f-81b3-4cfa-bf8e-f5023a7385c2","sha256":"sha256:37260183e345d6a22af60f08048d69c1902f6244cecc3a03b4280aa9c7849ff4"},"created_at":"2026-08-12T00:00:00Z","effective_status":"active","evidence_refs":{"imported":[],"missing":[],"model":[],"operator":[],"source":["sha256:283d0c3d81305e9b98c5cd13521a95c5cb4310115aaf0708b84889bfa6c94324"]},"expires_at":null,"freeze_ref":{"id":"c3c50c69-cbac-4cd3-a355-125f3066901a","sha256":"sha256:4971ba5888365a8f7bc0130e40fcca1817c7d439c8a39e68580175fe068a63e1"},"owner_placeholders":{"accepted_risk":"not_decided","conditions":"not_decided"},"projection_refs":{"client_safe":"2e61e94d-e05c-4ac9-9661-82683aca1bea","internal":"e1a49b15-5414-473e-a19a-2f0e6f8e12c8"},"promotion_provenance":{"preparation_ref":{"id":"05240bb5-7320-4405-9c2d-21dfe4938ed7","sha256":"sha256:d9b2e4c2c9b1711ab51c79b734eb7d53136a9a39aafdc4faf08133a441d22ec9"}},"protected_invariant_refs":[],"provenance":{"package_version":"0.4.0","policy_id":"community.acceptance.v1","policy_version":"1"},"recommendation":"held","reinspection_requirements":[{"id":"0c165a74-190c-4b4e-b4d1-c0d13c7277fd","sha256":"sha256:153468dea4bfb3c2cdcd73c528d2281bc4f77bc20bba650d9705f5576190dac1"}],"schema_id":"provan.acceptance_attestation.v1","settlement_ref":{"id":"f032ea43-4d3f-4e90-80ed-90bcaeef42bf","sha256":"sha256:3cd744d2420ddf7041a099c2344dde7a4d6374e2e60d16e6785b50a680502d43"},"subject":{"candidate_digest":"sha256:c13c4363119c3b3b00892ceb53d265fcb20656717654edfd4d7add782f927367","repository_identity":"https://github.com/kruthika-kumar/provan"},"usage":{"execution_calls":0,"model_calls":0},"verifier_state":{"capability":"unavailable","environment":"unqualified","execution":"not_run","work_order_refs":[]}}
