{"attestation_id":"fa9636be-2b95-49cf-a327-56f9584929ff","builder_provenance":{"package_version":"0.4.0","policy_id":"community.acceptance.v1","policy_version":"1","schema_registry_digest":"sha256:4883f894956a1a6c20135138a529c416ebd10004eea8931808a830054ff43758"},"challenge_state":{"pack":null,"requirement":{"challenge_budget":{"class":"not_required","max_instances":0,"max_network_requests":0,"max_wall_seconds":0},"criteria_requiring_challenge":[],"prohibited_actions":["challenge_generation","challenge_execution","pack_creation","seed_creation","sibling_creation"]},"seed":null,"siblings":"not_run","state":"not_run"},"conditional_activation":[],"context_provenance":{"brief_ref":{"id":"77c8fd30-fea2-434d-a856-bef31e4cf569","sha256":"sha256:2f15d7c4775588b9acd2dd9c969ff9b4ad86e9e3b0100e3aad5e4eaaf87cc143"}},"contract_ref":{"id":"9ef76163-cc6d-42ea-9ae2-ac25daa29229","sha256":"sha256:c9caae41b31e41de2616f9831368131233d7866d3bc9dfb42f400276a1b4726f"},"created_at":"2026-08-12T00:00:00Z","effective_status":"active","evidence_refs":{"imported":[],"missing":[],"model":[],"operator":[],"source":["sha256:6207bc4324a86b9790d6d4831f3f5e3da8032fba6e50ccd5b198ecfe515fe5b7","sha256:d2f0277887f1125879b7cb1254ddd9e1678328b17a6ad1764cb5ba4fb2b48727"]},"expires_at":null,"freeze_ref":{"id":"b6e5621a-e26a-4e90-91bd-f8f0b27e6e35","sha256":"sha256:32f7937db9956c901b02075fde57c11cd54e4fb3739be9cc4d72751866ee033a"},"owner_placeholders":{"accepted_risk":"not_decided","conditions":"not_decided"},"projection_refs":{"client_safe":"f17c301d-c52f-409b-92a0-fefb5f5adbe9","internal":"59789489-a069-4afb-9e6a-872a2b22c34b"},"promotion_provenance":{"preparation_ref":{"id":"6242fb8e-7a05-4d9b-93db-d3f975f39068","sha256":"sha256:33ee846bc79151173a21f57ebe7e57f2f895df763d508531898a1d0bc8ff7355"}},"protected_invariant_refs":[],"provenance":{"package_version":"0.4.0","policy_id":"community.acceptance.v1","policy_version":"1"},"recommendation":"held","reinspection_requirements":[{"id":"880f3f1d-f9ec-45ea-b78b-bf9289edf89a","sha256":"sha256:3ad379e6f4faddfc822e4af47d368efcdca175c9ba78827cb19cbeebb7a00df1"},{"id":"cd7e4ec5-6d4b-4af3-9f46-1a6096c3c026","sha256":"sha256:4b101cf481a806cde673f1c7b5d4bce3ad1c856b9b110b1cbcaa155269424c90"}],"schema_id":"provan.acceptance_attestation.v1","settlement_ref":{"id":"a4e3cc3d-ccd5-43ee-8616-62cd9093b148","sha256":"sha256:c5815ece0acd6c917949ec7f8cbab145777fd103c1beb84efed3f9243d10be58"},"subject":{"candidate_digest":"sha256:5dff6f7c79e6be1132c51fbba908efc68db902a762f224332fd204eaebf5327f","repository_identity":"https://github.com/encode/httpx"},"usage":{"execution_calls":0,"model_calls":0},"verifier_state":{"capability":"unavailable","environment":"unqualified","execution":"not_run","work_order_refs":[]}}
